id	category	descript
1270	FOOD	What is even better, is that the prices are very affordable as well, and the food is really good.
1271	FOOD	Good spreads, great beverage selections and bagels really tasty.
1272	PAS	Service was on par but not wonderful.
1273	MISC	This place was not ALL THAT!
1274	MISC	When I visited my friend who lives in the Upper Eastside, she recommended that we go to this restaurant.
1275	MISC	Never fails to please.
1276	FOOD	He not only makes his own homemade mozzarella, but every pie is ultra fresh.
1277	PAS	We ate out in the back patio, which is worth it as it's cool and the music is hear well there.
1278	FOOD	The food is alright - some stuff is good - some is not (like the steak dish which tends to be dry).
1279	FOOD	The environment is romantic, but the food is horrible, the service is pathetic, and gabriella lies about everything she could.
1280	FOOD	This place doesn't compare with Mamoun's in terms of price, freshness, value, and consisent quality, but that's just my opinion.
1281	PAS	Once you become a regular, you are treated as one.
1282	FOOD	The food was boring and expensive.
1283	PAS	Not the typical NYC gimmick theme restaurant.
1284	MISC	So eat fast and order a lot.
1285	MISC	This tiny Williamsburg spot is always pleasantly surprising.
1286	PAS	The only weird thing was if we got a bottle, the waitress would have simply multiplied the glass price X4, which makes no sense whatsoever.
1287	PAS	Slightly on the pricey side but worth it!
1288	FOOD	The wine list is extensive and can easily hike up an otherwise reasonably priced meal.
1289	FOOD	The combination of fresh tomato sauce, fresh mozz cheese, basil and the dough they make with imported flour, makes this is one of the better pizza's in NY.
1290	PAS	It is also extremely well priced.
1291	FOOD	The entree was bland and small, dessert was not inspired.
1292	MISC	I went to Ruby Foos for my birthday and enjoyed our experience there.
1293	FOOD	The burger was great, also.
1294	FOOD	Orsay, is a very pleasnt throw back to traditional French food, and French service as well.
1295	FOOD	Even upon delivery, their juicy pork buns are quite good . .
1296	MISC	I go back in line like three times on average until I can't walk anymore.
1297	FOOD	The service was excellent, the food was excellent, but the entire experience was very cool.
1298	FOOD	Aside from the rushed service, we were very impressed with the food and the drinks.
1299	FOOD	i recommend the thai popcorn :)
1300	FOOD	If you live in new york city, you'll find better food at small restaurants outside of time square and spend half the amount.
1301	FOOD	THE BIG COMPLAINT: NO TOASTING AVAILABLE.
1302	FOOD	Everything I had was good, and I'm a eater.
1303	PAS	This is such a lovely, peaceful place to eat outside.
1304	FOOD	The Waitstaff were very nice and suggested swordfish for my husband he enjoyed his meal.
1305	FOOD	Food is usually very good, though ocasionally I wondered about freshmess of raw vegatables in side orders.
1306	FOOD	Meanwhile, the bartender continued to pour champagne from his reserve after we had finished our bottle and we enjoyed an amuse of turnip soup with pureed basil, gratis.
1307	PAS	We were seated and ignored by waitstaff.
1308	FOOD	The pizza is delicious and the proprietor is one of the nicest in NYC.
1309	FOOD	They have a very diverse menu so its something for everybody.
1310	MISC	Tuk Tuk is my second favorite neighborhood Thai place (the first being Joya).
1311	MISC	Not someplace I would seek to try out but if I am in the area again, I will certainly stop by.
1312	MISC	brick oven gallery is My pick for best pizza restaurant anywhere.
1313	FOOD	The food is amazing!!!!
1314	FOOD	The freshest, best variety, and the fastest delivery.
1315	FOOD	Compared to Ess-a, Tal offers a less doughy bagel!
1316	MISC	believe us, we've been eating sushi for over 15 yrs.
1317	MISC	I cannot recommend OG more highly if I tried - check it out for yourself.
1318	MISC	Just go and see for yourself.
1319	MISC	Glad you have the luxury to throw out paying customers.
1320	MISC	No thanks!!!
1321	MISC	Having hunted around for a quiet, romantic, yet not hideously expensive restaurant I stumbled across reviews for La Lanterna and gave it a shot.
1322	PAS	Oh, don't even let me start with how expensive the bills were!
1323	PAS	Service was very friendly.
1324	PAS	You'll pay at least double at any other Italian restaurant in the city, and most still don't compare.
1325	FOOD	I love when restaurants think using fancy expensive ingrediants makes the food fine cuisine, even with no idea how to use them.
1326	MISC	One of the earlier people commenting on the restaurant did not get the that some experimenting is going on with the menu in a positive way.
1327	PAS	ALWAYS full with tourists (especially because of it's close proximity to Rockefeller Center).
1328	MISC	Love YUKA.
1329	FOOD	If you love wine and cheese and delicious french fare, you'll love Artisanal!
1330	MISC	I have had so many dinners here and it's always been perfect - on a date with my husband, with my mom, with girlfriends and larger groups.
1331	FOOD	The fries are yummy.
1332	FOOD	It's constantly open, catering to the Pakistani cabbies lined up on Crosby St., so there's more turnover with the food than you'd expect (i.e., surprisingly fresh).
1333	MISC	Judging from previous posts this used to be a good place, but not any longer.
1334	MISC	But I just would like to say I read the reviews people left and thats why I checked it out.
1335	MISC	Ciao Bella
1336	PAS	This place is incredibly tiny.
1337	MISC	LLOOVVE THIS PLACE.
1338	FOOD	The service was attentive, yet unimposing, the food was far better than many notorious restaurants in Midtown and the wine list is extensive and well priced.
1339	MISC	Very good value
1340	MISC	My girlfriend convinced me to go in the other night for a quick bite.
1341	MISC	We visit at least once a month.
1342	FOOD	Stick to dimsum, not super overpriced noodles.
1343	MISC	enough said!
1344	PAS	Even after they overcharged me the last time I was there.
1345	PAS	I like Cafe Noir dont get me wrong, it is jsut that the people who work there are evil and incompetent!!
1346	PAS	For two people with tip was less than $25 bucks.
1347	FOOD	The menu changed, portions were even smaller than before, a lentil dish was salty beyond edibility, a basmati rice dish lacked flavor.
1348	FOOD	The pesto pizza was excellent, thin-crust pizza with a nice amount of spicy Italian cheese that I'd never heard of before.
1349	PAS	Nothing better than buying a snapple for $3.25 too.
1350	FOOD	great eats, good times.
1351	FOOD	The calamari comes with an incredible sauce, and the duck noodles are yummy as well.
1352	MISC	Worth visiting the 1st Ave spot because it is the original store.
1353	FOOD	Solid wine list, knowledgeable staff, friendly owners and an adventurous, ever-changing menu keep us coming back.
1354	MISC	Excellent experience.
1355	MISC	I suspect this restaurant is what Rao's would be if it hadn't turned exclusive.
1356	PAS	We did have to wait at the bar for approx.
1357	FOOD	sometimes i get good food and ok service.
1358	FOOD	While this isn't classical restaurant fare, the chef has given new life to an old cuisine with some really innovative and tasty dishes that are genuinely Indian without being heavy or same old restaurant burn-outs.
1359	FOOD	- the bread at the beginning is super tasty and makes you want more - the pizza is delicious and comes in personal sizes, however be warned that the Peter's Favourite pizza with prosciutto and baby arugula is actually a margarite pizza with cold prosciutto and baby arugula on top, like a salad.
1360	FOOD	Lucky Strike is a great casual place to just grab a bite to eat.
1361	FOOD	Maybe I say so because it looked promising for people who like artery-clogging jewish deli food, but turns out to be poorly run and awful.
1362	MISC	As a Japanese native, I've lived in the Tristate area for over 8 years, but I was just so amazed at this place.
1363	FOOD	The noodle and rices dishes taste great.
1364	FOOD	all the food was excellent - considering the quality of food in most moderately priced restaurants is mediocre this was slightly more pricey and well worth it.
1365	FOOD	Good food.
1366	PAS	The waitstaff are all very busy, it's not outstanding service, but I've never been dealt with rudely.
1367	FOOD	They might be all business at the counter when you give your order, but their food says I love you.
1368	FOOD	Pizza was a little soggy.
1369	MISC	Go with a group of friends and you will have a great time.
1370	FOOD	The food here does a great service to the name (Cantonese that is...).
1371	FOOD	It is thick and slightly soggy.
1372	MISC	The catch is that you are charged extra for ANYTHING that you leave on your plate so don't be a greedy pig!
1373	MISC	I wish they would change back to what it was before.
1374	PAS	It took them 15 minutes to put water in our glasses.
1375	FOOD	The food is wonderful, tasty and filling, and the service is professional and friendly.
1376	FOOD	The dim sum however was very good.
1377	MISC	I love going there!
1378	PAS	It's charmingly small and that leads to an atmoshere that is extremely cozy and romantic, even.
1379	PAS	The restaurant looks out over beautiful green lawns to the Hudson River and the Statue of Liberty.
1380	MISC	We left after one drink.
1381	FOOD	And the food was fantastic.
1382	MISC	Make sure you try this place as often as you can.
1383	PAS	If the weather is nice, try to snag an outside table.
1384	FOOD	We had a wonderful meal at Naples 45 a month ago on a visit to NYC.
1385	MISC	I was turned on to this restaurant by a fellow foodie friend of mine, and have been going back regularly ever since.
1386	FOOD	Everything is excellent, the menu is quite extensive, and you eat with a view on both sides of the city.
1387	FOOD	The food arrived 20 minutes after I called, cold and soggy.
1388	MISC	However, it just so happens that there's an even more amazing place just down the street.
1389	MISC	i actually feel like i should keep it a secret.
1390	FOOD	But the main hit was the whole grilled fish.
1391	FOOD	it's the only place you can get yummy authentic japanese comfort food.
1392	FOOD	Try the tandoori salmon!
1393	PAS	The jukebox plays everything from Italian Opera to The Strokes.
1394	PAS	You can get an excellent meal at most of the many Indian restaurants on nearby Lexington Avenue for the cost of one the dainty dishes here.
1395	FOOD	From beginning appetizers, the scallops were incredible, to the delicious chocolate souffle with rasberry mint sorbet, we were delighted by the taste sensations.
1396	PAS	You have to increase the service a lot.
1397	MISC	Nice find.
1398	FOOD	Went there and had a combination of different seafood dishes and appetizers.
1399	FOOD	The sweet lassi was excellent as was the lamb chettinad and the garlic naan but the rasamalai was forgettable.
1400	MISC	I for one will never patronize them again.
1401	PAS	this little place has a cute interior decor and affordable city prices.
1402	FOOD	The dim sum servings here are a bit larger than I'm used to.
1403	MISC	Buon appetito!
1404	MISC	This place is always packed.
1405	PAS	The atmosphere was crowded but it was a great bistro-type vibe.
1406	PAS	We walked in on a Wednesday night and were seated promptly.
1407	MISC	Please if your thinking about it go, and stay the wait you won't be disappointed.
1408	PAS	($200 for 2 glasses of champagne, not too expensive bottle of wine and 2 after dinner drinks).
1409	FOOD	They sell special sushi, everything have a topping, sauce and etc.
1410	FOOD	The menu is very limited - i think we counted 4 or 5 entrees.
1411	FOOD	My GF and I still choose to eat there a lot because of diverse cocktails, the chill decor, and the decent sushi.
1412	MISC	It has been my first choice ever since I discovered it .
1413	FOOD	Moules were excellent, lobster ravioli was VERY salty!
1414	FOOD	the drinks are amazing and half off till 8pm.
1415	PAS	Great people watching as others do the same to you.
1416	MISC	You fellas above says its the best Taiwanese restaurant in town.
1417	FOOD	Service here was great, food was fantastic.
1418	MISC	So rude.
1419	PAS	Cute place, nice wait staff but would never go there again.
1420	PAS	Much of the time it seems like they do not care about you.
1421	FOOD	Best dish is nori-wrapped tuna.
1422	MISC	It was raining, and we figured why not?
1423	FOOD	Three courses - choices include excellent mussels, puff pastry goat cheese and salad with a delicious dressing, and a hanger steak au poivre that is out of this world.
1424	MISC	I'm from England, and Haru's was the best I had in NYC.
1425	PAS	Service was also very good.
1426	MISC	It was good, but was not what I thought it would be.
1427	FOOD	The cream cheeses are out of this world and I love that coffee!!
1428	MISC	It is the best hidden spot there and I rave about it to everyone.
1429	MISC	We will return many times for this oasis in mid-town.
1430	MISC	For those that go once and don't enjoy it, all I can say is that they just don't get it.
1431	FOOD	The food is delicious and beautifully prepared along with the friendly and personable service.
1432	FOOD	Okay-i don't mind the oily part (cause most are cooked that way) but it was way too bland.
1433	FOOD	Even better, they know how to cook French classics like Steak au Poivre and Onglet without burning it to death or overcooking it.
1434	MISC	In any event, even though its a bit on the pricey side, we still love this restaurant and will definitely go back.
1435	FOOD	Do not get the Go Go Hamburgers, no matter what the reviews say.
1436	MISC	I highly recommend the restaurant based on our experience last night.
1437	FOOD	Our favorite meal is a pesto pizza, the house salad, and a good bottle of wine.
1438	MISC	A hearty two thumbs up!
1439	PAS	This is a wonderful place on all stand points especially value ofr money.
1440	PAS	Service is not what one would expect from a joint in this price category.
1441	PAS	During our meal, the management came over and checked on us and even bought us a round of drinks.
1442	MISC	I agree.
1443	MISC	I thanked my friend who recommended me this restaurant and will certainly recommend it to others.
1444	MISC	Don't leave without trying One Night in Tokyo.
1445	MISC	Same owner as the guy who owns Typhoon, which is just down the street on St. Marks and 1st Ave.
1446	FOOD	We had Pam's special fried fish and it was amazing.
1447	FOOD	We concluded with tiramisu chocolate cake, both were delicious.
1448	MISC	Based on the reviews on here, it appears that the restaurant is overwhelmed after the 7 PM.
1449	FOOD	The place is small and cramped but the food is fantastic.
1450	MISC	Faan is sooo good.
1451	PAS	The service was terrible, we had to wait for everything and ask several of different people for the same thing before we were allowed to be served.
1452	FOOD	The food was good.
1453	MISC	Authentic bistro!
1454	MISC	Okay, so I never write but there doesn't seem to fair balance of positive to negative reviews concerning Green Bo and it's time to speak up - I live in Chinatown.
1455	MISC	We got in line and were served while in line a bannan fritter.
1456	MISC	I had a great experience.
1457	FOOD	The dim sum is ok but doesn't taste that fresh, and the little dishes don't look steamy hot as they should (also note lack of Chinese here).
1458	MISC	Avoid at all costs.
1459	MISC	This is where the aforementioned line was.
1460	PAS	The staff has been nice, but they seemed really stressed and the unisex bathroom needs to be cleaned more often.
1461	MISC	It appears to be the owner's first venture and it shows.
1462	MISC	Conveniently located too, being right on Bedford ave.
1463	PAS	Not pretentious and very economical.
1464	PAS	The prices are wonderfully low.
1465	FOOD	The food was great.
1466	MISC	Went here last night and had a pleasant experience.
1467	PAS	The music is the best among all the Indian restaurants I have visited.
1468	FOOD	Over the years, it has always provided a pleasurable dining experience with quality food and wine.
1469	MISC	I live in the neighborhood and my friends meet me down here not only for the bar scene but also the promise of The Pizza Place at 3am.
1470	FOOD	We parked on the block of Nina's the place looked nice, with people obviously enjoying their pizzas.
1471	FOOD	However, if you want great food at a great price and don't mind the decor, you can't beat this place.
1472	FOOD	Everything is always cooked to perfection, the service is excellent, the decor cool and understated.
1473	MISC	Went there for an office lunch.
1474	FOOD	The photobook menu was a cute touch, certainly helped my group and I pick the fried chicken, pork chop, and noodle dishes that we all ordered.
1475	FOOD	The beverages were excellent, and the dessert was good.
1476	MISC	Probably would not go again...
1477	MISC	This restaurant used to be our regular Thursday night dinner location.
1478	FOOD	We actually left hungry and went across the street to Wo Hop at 15 Mott street for some good chinese food.
1479	MISC	and never strayed.
1480	FOOD	Service was good and food is wonderful.
1481	MISC	We had a most unpleasant experience at this restaurant.
1482	FOOD	Grilled whole fish wonderful, great spicing.
1483	FOOD	So, the menu is written in chalk above your head and it all sounds delicious.
1484	MISC	Look elsewhere.
1485	MISC	This time, I prefer not to go into detail.
1486	FOOD	Killer Sushi!
1487	FOOD	While the food was good (certainly no Il Mulino) the service was horrendous.
1488	PAS	The service was ok.
1489	PAS	A little crowded but they move that line really fast!
1490	FOOD	Ess-A-Bagel (either by Sty-town or midtown) is by far the best bagel in NY.
1491	PAS	To dine at Thalia can be slightly deceiving because while its beautiful on the outside, its so bland on the inside.
1492	MISC	I went to Ruby Foo's after work with a group of 6.
1493	FOOD	If you're craving for Haru's great food, especially the House Roll, but can't stand the wait building outisde, head across the street to their Sake Bar!
1494	MISC	I haven't been to the other locations.
1495	FOOD	The sides were ok and incredibly salty.
1496	PAS	They never came back to refill our glasses again.
1497	MISC	Maybe tomorrow ;-)
1498	MISC	I would definently recommend this restaurant.
1499	FOOD	The food was not very tasty, the portioins were tiny even for such a high quality restaurant.
1500	PAS	The service was typical short-order, dinner type.
1501	MISC	I only have friends.
1502	FOOD	great food, lt's of it, more then one person can eat!
1503	MISC	Good French restaurant in an area devoid of decent restaurants unless you're into eating 4 pound pastrami sandwiches at Katz' Deli, or Mexican food which is supplied by capable restaurants.
1504	MISC	I really liked this place.
1505	FOOD	They came out over cooked and the cheese was almost non existant.
1506	PAS	When you enter, you feel like you have entered your mom's kitchen.
1507	MISC	This is probably one of my new favorite places.
1508	PAS	I can't wait for summer, when they serve outside on their gigantic patio.
1509	MISC	We will be back.
1510	FOOD	The pizza is good though.
1511	PAS	The place is larger than most and features adequate seating unlike most joints, and has a bar which deserves a mention.
1512	MISC	We were in search of food and stumbled on this block of Indian restaurants on East Sixth Street.
1513	FOOD	My steak au poivre was one of the worst I've had.
1514	MISC	It seems like this is a place the locals like and the people working here liked it too.
1515	MISC	One of my favorite places in Manhattan.
1516	FOOD	I would not have been so disappointed with the portions if the qualities were good enough to make up for it, but they were not!
1517	PAS	It's a great place to pick up a cheap lunch or dinner.
1518	MISC	Been going here since it opened have seen the quality value decrease considerably.
1519	PAS	Warm, comfortable surroundings, nice appointments (witness the etched glass and brickwork separating the dining rooms).
1520	PAS	It took them 25 minutes to bring our appetizer.
1521	PAS	The bartender on my most recent visit was so incredibly rude that I will never go back.
1522	FOOD	If the omakase is to showcase technique and variety, serving almost 40% of items BBQ-ed and a spicy tuna roll wrapped with not-so-fresh nori seems to be a rather limp performance.
1523	FOOD	I ordered a Chicken Teriyaki dish and found that the chicken was extremely dry.
1524	MISC	The staff isn't the friendliest or most competent, and I am stickler for service, but everything else about this place makes up for it.
1525	MISC	I'd definitely recommend this little place.
1526	FOOD	The Pastrami sandwich was like buttah and with pickles and an icy cold beer to wash it down, it was a pleasurable experience.
1527	FOOD	honestly the worst sushi my husband and i had in our entire lives.
1528	FOOD	I have eaten at Saul, many times, the food is always consistently, outrageously good.
1529	PAS	Service is not exactly five star, but thats not really a big deal.
1530	PAS	It cannot be the ambience, because the place is very cramped and some guests have to sit in an aisle.
1531	FOOD	It is obvious that no one in the restaurant has any idea about or experience with Japanese cuisine.
1532	FOOD	We were fans of the half-price Saturday night option until some inedible squid during a recent visit.
1533	PAS	But for whatever reason, prices are about twice as high.
1534	MISC	I grew up eating Dosa and have yet to find a place in NY to satisfy my taste buds.
1535	FOOD	Go to Volare for 1st class service and terrific food.
1536	PAS	Note that they do not serve beer, you must bring your own.
1537	FOOD	The shrimp scampi was excellent and the antipasti were plentiful.
1538	MISC	it helps if you know what to order.
1539	MISC	It is so easy to get a reservation at a top place in NYC with a week's notice.
1540	MISC	Suan is a great place that I often take my friends (classmates) too.
1541	FOOD	Everything we had was pretty good, but we have only been there once.
1542	PAS	The main downside to the place is the nazi-like guy running it who constantly complains about the noise level.
1543	FOOD	They need a kick out of it but until then the sushi is pretty good and the place is consistent.
1544	MISC	If you like the food and the value you get from some of Chinatown restaurants, this is not the place for you.
1545	FOOD	Try the mediterranean salad, it is a true experience for your taste buds!!
1546	PAS	Even though it is a little loud, you don't have to yell at each other to talk.
1547	PAS	The waiters were not attentive except that the bill turned up on the table before we were finished.
1548	FOOD	I really loved the different and inovated touch that's the cheff gives to the food.
1549	FOOD	This is the best sushi in new york city - hands down.
1550	FOOD	Good food.
1551	MISC	And when I visit her I make it a point to eat at 'Ino at least once daily if not once for the whole trip.
1552	FOOD	The food is okay and the prices here are mediocre.
1553	FOOD	The palak paneer was standard, and I was not a fan of the malai kofta.
1554	FOOD	love the food.
1555	MISC	You will be satisfied.
1556	PAS	Whem asked, we had to ask more detailed questions so that we knew what the specials were.
1557	FOOD	The food is tasty and portion sizes are appropriate.
1558	PAS	Great spot, whether looking for a couple of drinks or quiet dinner.
1559	MISC	So some of the reviews here are accurate about the crowd and noise.
1560	FOOD	For some reason, all the seafood on the menu was unavailable except for the Salmon.
1561	MISC	I've never been disappointed.
1562	MISC	Haru on Park S is simply disgusting.
1563	FOOD	go here for the drinks!
1564	MISC	please don't fool us.
1565	FOOD	Consistently good Japanese Tapas.
1566	MISC	I've been here twice now.
1567	MISC	Obviously the Chinese translation of this place does not mean Big Wong, it actually means Great Prosperity.
1568	MISC	We've only eaten in the restaurant once, but we have ordered many times for dinner.
1569	FOOD	And you're hungry a few hours later.
1570	FOOD	The other night we had the $30 three course meal and everything was delicious - if I could of licked the plate clean I would of.
1571	FOOD	Perhaps this food is considered extreme to an Upper East Side resident, but for the rest of us who've actually eaten ethnic food, this is simply dull.
1572	FOOD	The food looked very appetizing and delicious since it came on a variety of fancy plates.
1573	PAS	The service was attentive.
1574	PAS	Service was decent, but not as smooth as I would expect from a place with these prices and reputation.
1575	FOOD	I cannot imagine better Indian food in all of the city.
1576	FOOD	great place to go for a drink too because they have 100 kinds of beer.
1577	FOOD	Two people in our party felt like something else, and Volare immediately obliged with two great dishes that were not in their regular menu.
1578	MISC	If you live outside the neighborhood, don't bother!
1579	MISC	Don't waste your time, or money!!
1580	MISC	We liked it so much, that we will always make it a point to dine here when we visit New York.
1581	PAS	Went there with my wife and we had to wait for a table even though you could see there many that were empty with not reservation sigh on them.
1582	PAS	we came here on a crowded saturday night and were seated right away despite being 15 minutes late for our reservation.
1583	FOOD	The wine list is excellent.
1584	PAS	The noise level was unbearable, conversation impossible.
1585	FOOD	We had a great tiem watching the shows and characters and ar food was just what we were looking for.
1586	FOOD	The fish is fresh but the variety of fish is nothing out of ordinary.
1587	PAS	Aside from the bearded, courdoroy blazer professor type with the NYU student he's sleeping with that week, you see a strange mix of hipsters, frat boys, Will Smith types who need to be told they are black, bitter cougars who cant understand why they arent married yet....
