id	category	descript
1588	MISC	I don't know about you guys, but when I go somewhere to eat I go for the food not for the atmosphere.
1589	MISC	I recently tried Suan and I thought that it was great.
1590	PAS	Good crowd, good outdoor seating, with a hip japanese vibe.
1591	PAS	Even with a relatively inexpensive botle of wine, if you can call $70.00 inexpensive, the cost is through the roof for better than average fare.
1592	FOOD	The food was below average, the service was pathetic, there was no ambience at all.
1593	FOOD	The pizza here is delicious.
1594	MISC	That's why you have to pay more for that.
1595	FOOD	The food can get pricey but the prixe fixe tasting menu is the greatest food for a good price and they cater the food to any food allergies or food you don't like.
1596	PAS	The service was impeccable and unobtrusive -- the staff knows what they are there to do -- to know their menu, present your meal, and attend to your needs.
1597	FOOD	The sandwiches are dry, tasteless and way overpriced.
1598	PAS	It's a small cute restaurant.
1599	MISC	Went last Thursday.
1600	PAS	The staff was too busy ordering sushi for dinner and then laying it out to eat on the bar to even bring me my check.
1601	FOOD	I had their eggs benedict for brunch, which were the worst in my entire life, I tried removing the hollondaise sauce completely that was how failed it was.
1602	PAS	whoever the jazz duo was, they were on POINT.
1603	MISC	Don't go there!
1604	PAS	but the service was a bit slow.
1605	PAS	The establishment scores big points in presentation and style.
1606	PAS	Oh yes, and if you are a fan of Indian oldies film stars, there are plenty of portraits of Indian actors and actresses in classic black white that adorn the walls, some of which, I would love to know where they obtained.
1607	FOOD	I was very impressed by this low-key upper eastsider and their authentically thai cuisine!!!
1608	MISC	Perhaps.
1609	MISC	Look I dont know if the people who wrote the reviews have ever been to a decent place (PLEASE TRY SOMEOTHER PLACES).
1610	PAS	Oh and it's too tiny for families with strollers.
1611	PAS	The only thing the waiters don't do for you is wipe your chin when you leave.
1612	FOOD	The flavors are great, and the menu is extensive.
1613	MISC	(I've ordered from the 2nd ave.
1614	FOOD	The specials are usually quite good too.
1615	FOOD	i've been back to nha trang literally a hundred times for the beef cubes - they're that good.
1616	FOOD	The dinner was ok, nothing I would have again.
1617	FOOD	The duck confit is always amazing and the foie gras terrine with figs was out of this world.
1618	PAS	If you go to Roth's try to be served by Mike, he is GREAT!!
1619	PAS	A large is $20, and toppings are about $3 each.
1620	MISC	This is a great place to take out-of-towners, and perfect for watching the sunset.
1621	MISC	Go, go, hurry, before everyone finds out about it.
1622	FOOD	Great wine list, reasonably priced.--Sara
1623	FOOD	Everything, from the soft bread, soggy salad, and 50 minute wait time, with an incredibly rude service to deliver below average food.
1624	MISC	Dinner took almost 4 hours without any lag time.
1625	FOOD	We could only get through an appetizer and cheese fondue.
1626	FOOD	Good food at the restaurant (a bit expensive, but great if you want to impress your date).
1627	PAS	For the location, the prices are very reasonable.
1628	PAS	Service was prompt, friendly and great.
1629	FOOD	The food is good, but very expensive for the casualness of it.
1630	FOOD	The best pad thai i've ever had.
1631	PAS	The restaurant is dark and not very attractive and then you have spot lights shining on you putting you in the worst light possible, reaching for sunglasses.
1632	MISC	And that's no mean feat...
1633	MISC	I've been here a couple of times and have not been impressed.
1634	PAS	Decor is charming.
1635	MISC	Worth a visit.
1636	FOOD	The pizza was great.
1637	FOOD	We had champagne and caviar and felt like princesses!
1638	FOOD	The food options rule.
1639	PAS	The prices and ambience are especially great considering it's in the West Village.
1640	PAS	The service was bad, the food took to forever to come, we sat on the upper level.
1641	FOOD	The highlight of the night was the mayonaisse for my side of fries I received from one of the food runners, which is not good considering the bill was nearly $100.
1642	FOOD	The service is a little scatty at times but all is forgiven when the food arrives.
1643	FOOD	We went here for lunch a couple of weeks ago on a Saturday, and I was thoroughly impressed with the food.
1644	PAS	Last time I went here, the waitress didn't come back after taking our order.
1645	PAS	We were pleasantly greeted.
1646	FOOD	Really though, where's the seasoning?
1647	PAS	Always popular, always full, always a wait.
1648	FOOD	Super friendly and knowledgable staff, fabulous bistro fare and a wonderful jazz brunch with great live jazz (the chilaquiles were awesome!
1649	PAS	Decor is nice though service can be spotty.
1650	MISC	If you are a vegetarian, this really isn't a good place to go.
1651	PAS	And forget what you read under me, the atmosphere isn't that bad either.
1652	PAS	Really cool stauff inside.
1653	FOOD	Planet Thailand has always been a hit with me , I go there usually for the sushi, which is great , the thai food is excellent too .
1654	MISC	Was there Friday night.
1655	MISC	Enjoy!!!
1656	MISC	If only they delivered, they'd make a mint!
1657	MISC	We always get a sampling of appetizers and share.
1658	MISC	I went to Amma after a friend recommended it.
1659	MISC	It just wasn't Thai.
1660	MISC	Recommendations, of course, are required!
1661	FOOD	We ordered some beef and noodle soup dishes from the Thai section of the menu but nothing we got was Thai.
1662	PAS	All conveniently delivered right to the door.
1663	FOOD	Great pizza for lunch place.
1664	MISC	Big thumbs up!
1665	MISC	during happy hour!
1666	FOOD	The zucchini and mashed potatoes are a blend of garlic and butter which simply melts in your mouth.
1667	MISC	NO PIZZA 33 for me!
1668	PAS	Once you step into Cosette, you're miraculously in a small, off-the-beaten path Parisian bistro.
1669	FOOD	In fact, two people could really share one plate.
1670	PAS	The service is ok but could be better.
1671	MISC	We weren't!
1672	MISC	The restaurant was packed at first, so we waited at the bar for about 20 minutes before we were seated.
1673	MISC	Nice place though.
1674	MISC	I have tried the various slice joints around the village but this is by far the best one.
1675	MISC	When going out for a nice dinner, I like a nice ambiance as well as very good food.
1676	PAS	The most annoying thing, though, is the fact that the servers seem to be trained to drive revenue.
1677	PAS	My host asked for appetizers for the group and the waiter gave us not only what we ordered, but some other items that were not ordered.
1678	MISC	This restaurant is a wonderful place to go many times and it is reasonably priced.
1679	PAS	Its a go-to for dates as well as entertaining out of town guests.
1680	FOOD	The food itself was just ok - nothing spectacular - but the service was awful.
1681	MISC	I would highly recommend this place to everyone for any occasion!
1682	MISC	Went with mommy (the only person who could afford taking me here).
1683	MISC	If you wrote a bad review, it's because you don't understand what Rao's is all about.
1684	MISC	If I wanted to deal with a crappy scene and annoying customers I'd go out in Manhattan.
1685	PAS	The service is awful.
1686	MISC	I would never wait for a table to eat, it just is not THAT great.
1687	FOOD	Nevertheless the food itself is pretty good.
1688	MISC	It's really a takeaway place, I wouldn't sit if I could take it home.
1689	MISC	They also do a great job for restaurant week.
1690	MISC	I will definetly be going back.
1691	MISC	Guess the 555Soul ads didn't launch her big modeling career.
1692	PAS	Even though the restaurant was packed, we were seated promptly and even asked for a table upstairs with no problems.
1693	FOOD	Food is great.
1694	MISC	we were tired and cold when we got to the restaurant, then we sat down to begin ordering appetizers.
1695	FOOD	From the terrible service, to the bland food, not to mention the unaccommodating managers, the overall experience was horrible.
1696	FOOD	All the money went into the interior decoration, none of it went to the chefs.
1697	MISC	I live nearby and when they first opened, I ate there a lot.
1698	PAS	When family came in he gave them apps to test their palets, and then ordered for them.
1699	MISC	Kudos Haru
1700	MISC	This is as good as neighborhood restaurants come.
1701	FOOD	Lived in Shanghai most of my life and thought the food was comparable to the flagship Green Bo restaurant there.
1702	FOOD	Quality of food is excellent and price is cheap, stick to pork, fish, chicken, lamb and vegetables.
1703	FOOD	However, service was as plain as sesame crusted Salmon I had.
1704	MISC	David, Daytona Beach, FL
1705	MISC	This restaurant was way overhyped.
1706	FOOD	While I quite liked the food and the ambience, I'm not quite sure if it they really deserve it the Michelin rating they have displayed so prooudly in the window.
1707	PAS	The manager claimed that he could not compensate us for anything on the bill which just shows the lack of sophistication from the entire group.
1708	FOOD	Mizu is home to creative and unique rolls not to found anywhere else.
1709	FOOD	This was my frist time at Cafe St. Bart's and I must say how delicous the food and the service was.
1710	FOOD	The food, drinks and service are clearly among the best in the city.
1711	MISC	Definately check it out!!!
1712	FOOD	but when we looked at the menu, there weren't a lot of choices, most of them were dumplings in the appetizer section.
1713	PAS	The atmosphere is much better than Sripraphai (more modern and sleek).
1714	FOOD	But after last night, Spice Grill is the only place I'm eating indian cuisine.
1715	FOOD	I have been a longtime fan of Holy Basil in the East Village, and while I do believe their food has slightly slipped in quality, I have been hesitant to be disloyal.
1716	MISC	I was there on sat.
1717	FOOD	sometimes i get bad food and bad service, sometimes i get good good and bad service.
1718	FOOD	Food was good not great not worth the wait or another visit
1719	FOOD	Little Tonino's is just awesome, our favorite delivery place in Kennsington, honestly the best Gnochi I have ever had!
1720	FOOD	To finish off such a delightful dinner experience you must have dessert, especially the White Chocolate Bread Pudding with Gelato and hot chocolate.
1721	PAS	Now it's so crowded and loud you can't even talk to the person next to you.
1722	MISC	I went to DF for Valentines Day dinner.
1723	MISC	Our friends have not arrived yet.
1724	FOOD	We ordered the chicken casserole, but what we got were a few small pieces of chicken, all dark meat and on the bone.
1725	MISC	But they do.
1726	FOOD	It's just O.K. pizza.
1727	FOOD	The pizza was delivered cold and the cheese wasn't even fully melted!
1728	PAS	The staff there is very attentive and down to earth.
1729	FOOD	These innovators of french indian fusion do a great job of making dishes as interesting as possible while still being accessible.
1730	FOOD	The staff is accomodating, the ambiance is exciting and yet relaxed, and the food is out of this world!
1731	MISC	Overall, I'm still impressed that the place even exists and the prices are quite decent but then again, its Chinatown.
1732	PAS	They charge $6.00 for rice.
1733	PAS	All the NYU students love this place so it makes for a fun young atmosphere.
1734	MISC	We were less than impressed.
1735	MISC	Saul is the best restaurant on Smith Street and in Brooklyn.
1736	FOOD	Cheese plate is a varied delight and great bargain at $10.
1737	FOOD	I must warn the reader that the portions sizes are very small (especially the appetizers), so if you plan to eat until you are full and do not intend to order the chef's special tasting menu, prepare to order and pay for an appetizer (1 dish for each person because the portions are not for sharing), a main entree, and the cold udon at the end of the meal.
1738	FOOD	I highly recommend Caviar Russe to anyone who wants delicious top grade caviar and fantastic service.
1739	MISC	I have to say that if this what makes it easier to get a saet a lunch- I dont mind.
1740	PAS	As far as the service goes, the waitresses were not particularly friendly, but they got the job done.
1741	MISC	When we left at 8:00 PM, it was packed and noisy.
1742	PAS	The ambience is authentic and relaxing and we have always received attentive and prompt service.
1743	FOOD	The fish was not fresh and the rice tasted old and stale.
1744	PAS	The entertainment was great they have shows that go on through out the dinner.
1745	FOOD	I recommend their Pad See Ew, Pork Chops or Tofu plates.
1746	PAS	The seating was if they were trying to get the maximum amount of people into the restaurant, so be nice to your neighbor when you dine here.
1747	MISC	We would return to this place again!
1748	MISC	This is the best thing in Soho.
1749	PAS	Make reservations but expect to be delayed 15-20 minutes as the hosting staff was having difficulty seating guests who arrived with a reservation because they probably had a lot of walk ins being so close to Time Square.
1750	MISC	Boy was I wrong!
1751	MISC	I complete the total bagel experience by having it lightly toasted.
1752	FOOD	Still, any quibbles about the bill were off-set by the pour-your-own measures of liquers which were courtesey of the house...
1753	FOOD	Nice atmosphere, the service was very pleasant and the desert was good.
1754	FOOD	I understand the area and folks you need not come here for the romantic, alluring ambiance or the five star service featuring a sommlier and a complicated maze of captain and back waiters - you come for the authentic foods, the tastes, the experiance.
1755	MISC	it is not consistent.
1756	MISC	happy to be a regular at this place and would warmly recommend it to anyone.
1757	MISC	Love Pizza 33..
1758	FOOD	You can certainly find restaurants that offer a superior fine dining experience, but for superb food at reasonable prices, La Villa can't be beat.
1759	MISC	Its worth the wait though.
1760	FOOD	Ive been to many Thai restaurants in Manhattan before, and Toons is by far the best Thai food Ive had (except for my mom's of course).
1761	FOOD	then we ordered a dinosaur rolls and white tuna sashimi.
1762	MISC	great experience overall.
1763	FOOD	The wine and cheese plate are plentiful and can't wait to try the fondue or table grilling.
1764	MISC	Chance is a joke.
1765	MISC	This was one of the BEST restaurants I've ever been to.
1766	FOOD	Veal Parmigana - Better than Patsy's!
1767	PAS	I won't go back unless someone else is footing the bill.
1768	MISC	The strong scents coming from the left and right of me negatively affected my taste buds.
1769	MISC	Would recommend this place as a good date spot if you don't want to drop a ton of cash.
1770	MISC	We were pleasantly surprised.
1771	MISC	Skip this location and go to the one in Soho.
1772	MISC	I would highly recommend this place!
1773	FOOD	My friend got the mushroom pizza which tasted better.
1774	MISC	for my birthday and we had an excellent time.
1775	MISC	I would highly recommend this place to anyone looking for a casual atmosphere that whisks you away to the left bank of the river Seine.
1776	MISC	Bravissimo !!
1777	MISC	I had very high expectations for this place and made a reservation a couple of months in advance for a special occasion.
1778	PAS	Cornelia Street looks like a Broadway set for West Side Story and the inside of Po is so cool quaint you really can't top the setting for a romantic dinner in NYC.
1779	PAS	Some of the workers ignore me and talk to the female customers, other times, they've skipped my order.
1780	PAS	The place was quiet and delightful.
1781	FOOD	Each table has a pot of boiling water sunken into its surface, and you get platters of thin sliced meats, various vegetables, and rice and glass noodles.
1782	MISC	I have taken practically every guest that has come to visit me in NY and hooked a few New Yorkers onto Peep as well.
1783	MISC	I love the place.
1784	MISC	It is nearly impossible to get a table, so if you ever have the chance to go here for dinner, DO NOT pass it up.
1785	FOOD	The wine selection (by the glass and bottle) is wonderful and I always recommend that friends make a reservation if they're going to be in town.
1786	FOOD	Food is great and inexpensive.
1787	MISC	We weren't even at our table for more than an hour total.
1788	FOOD	The steak was very fatty and the sauce was overpowering and not very tasty.
1789	MISC	I went there for lunch and it was not as good as I expected from the reviews I read.
1790	FOOD	I have eaten there 3-4 times and the food was always good.
1791	MISC	Overall I would recommend it and go back again.
1792	FOOD	A cool place to hang with your friends for a couple of healthy drinks and desserts.
1793	MISC	Faan's got a great concept but a little rough on the delivery.
1794	FOOD	Nothing fancy but really good food with pretty reasonable price.
1795	MISC	I have walked by this place for eons and finally went thanks to a girls' night.
1796	MISC	Check it out.
1797	FOOD	I like the somosas, chai, and the chole, but the dhosas and dhal were kinda dissapointing.
1798	FOOD	As we were sitting eating the subpar food the manager proceeded to berate a couple of his employees for putting out the wrong containers for condiments and explained to them how expensive these containers were.
1799	PAS	They wouldnt even let me finish my glass of wine before offering another.
1800	PAS	This place would be so much better served by being run by a group that actually understands customer service.
1801	MISC	As soon as I wake up on a saturday or sunday it is the first thing on my mind is when and how I will be getting to fried dumpling.
1802	FOOD	The Pad thai, lad nar and various other dishes all look good on paper but, I've had better thai food in less asthetically pleasing places.
1803	PAS	This place is the most Japanese it can ever get.
1804	PAS	The service is ok, some of the people didn't get what they asked for.
1805	PAS	Because we didn't have a reservation, we could only sit in the back garden, but it was great, secluded and perfect in nice weather.
1806	MISC	It was wonderful.
1807	FOOD	Their sake martini is wonderful.
1808	FOOD	If you don't mind pre-sliced low quality fish, unfriendly staff and a sushi chef that looks like he is miserable then this is your place.
1809	PAS	And affordable.
1810	MISC	If just to drop in, quickly stuff yourself and jet out -- to keep their turn-over.
1811	PAS	The service, however, was a bright flower in a garden.
1812	FOOD	After we got our sashimi order, I could not believe how small the portions were!
1813	MISC	This was the worst dining experience I've ever had.
1814	FOOD	As for the bar, this is another bad idea.
1815	FOOD	Spice is great Thai food, love the inexpensive appetizers.
1816	FOOD	Staffs are not that friendly, but the taste covers all.
1817	MISC	Based on a visit a month ago, I returned the week before Christmas and was hugely disappointed.
1818	PAS	Ask for Usha, the nicest bartender in manhattan.
1819	MISC	Took my sister here before attending a show one evening.
1820	FOOD	The meat dishes were only so-so.
1821	MISC	If you are the type of person who likes being scared and entertained, this is a great place to go and eat.
1822	FOOD	This is one of the best comfort food places in the city.
1823	FOOD	Their coffee is quite good too!
1824	FOOD	It may be a bit packed on weekends, but the vibe is good and it is the best French food you will find in the area.
1825	FOOD	The sauces used are also not that exciting.
1826	MISC	I thought this place was totally overrated.
1827	FOOD	My suggestion is to eat family style because you'll want to try the other dishes.
1828	PAS	Also they were $15 each!
1829	FOOD	Considering their price of $6.25 for lunch special, the dish was ridiculously small.
1830	MISC	I am going to the mid town location next.
1831	PAS	Indoor was very cozy and cute.
1832	PAS	In reality (to maximize potential diners) they were still taking phone reservations and reallocating tables of those waiting in the lobby.
1833	FOOD	Service is great, takeout is good too.
1834	FOOD	The food's as good as ever.
1835	PAS	Nice restaurant overall, with classic upscale Italian decor.
1836	MISC	Bon appettite!!
1837	MISC	for out-of-towners who will get a big thrill out of the location!
1838	MISC	On a monthly basis my friends and I get together and have a girls night out.
1839	MISC	The only possible drawback to this last point is that as of the date of this posting, the additional menu items are only written in Chinese.
1840	PAS	This place has the the correct ambience and an excellent staff to make you feel like a guest and a friend at the same time.
1841	FOOD	The food, served in small tasting portions (as an option) is very good with each dish being better than the next.
1842	FOOD	My wife and I ate here earlier this week and have not stopped ranting and raving about the food.
1843	PAS	Well, this place is so Ghetto its not even funny.
1844	MISC	Heartland Brewery is a great way to start or finish your day.
1845	FOOD	the real kicker of the menu, however, is the beef cubes or the chicken with chili and lemon grass.
1846	FOOD	Consequently, their burgers fell apart in their hands and made such a mess that they did'nt feel like finishing them.
1847	FOOD	Wonderful strawberry daiquiries as well!
1848	FOOD	All the pastas are fantastic and the homemade lasagna is some of the best that I have had in the City.
1849	PAS	Not cheap, but not that expensive either.
1850	MISC	On a recent Sunday afternoon, a friend and I accidently found this great restaurant on our way to see the pulitzer prize winning play DOUBT.
1851	FOOD	However, they've got the most amazing pastrami and the soups hit the spot.
1852	MISC	I have to say that I am pleasantly suprised and I will most likely stop in again if I am in the neighborhood.
1853	FOOD	Definite go if you're used to good Indian restaurant food from abroad.
1854	PAS	It's also attached to Angel's Share, which is a cool, more romantic bar...
1855	MISC	The only other steakhouse that seems to hold a candle to Roth's is the Strip House.
1856	PAS	Complimentary stuff kept coming, and when the waiter saw me opening a gift, I received my dessert on a plate that had Happy Birthday written on it, with a candlevery nice touch, and attentive staff.
1857	MISC	Going to Ballato's is like coming home and eating in my own kitchen, an absolute delight!
1858	FOOD	The drinks are always welll made and wine selection is fairly priced.
1859	MISC	This place must have cost the owners afortune to build.
1860	MISC	Sure, everyone's got their favorite, but to know Sal, is to know New York.
1861	FOOD	The food was so-so.
1862	PAS	It is LOUD, HOT and DARK.
1863	FOOD	My husband and I both ordered the Steak, medium.
1864	FOOD	We all had the tasting menu and unlike some of the other reviews, I felt there was more than enough food.
1865	FOOD	So much more than the usual bar food, go there to enjoy the menu while sampling one of their hand-crafted beers.
1866	MISC	Go for it!
1867	FOOD	My fish was delicious in an incredible curry sauce.
1868	MISC	My husband and I have been there a couple of times and each time we sat at the sushi bar (chef Yoshi) and ordered everything ala carte.
1869	MISC	Ok, for all of us growing up in the Village of NYC, we have spoiled by a plethora of restaurants, most of which stay open very late.
1870	FOOD	The main course had an average portion, and was decent overall.
1871	PAS	The hostess is rude to the point of being offensive.
1872	PAS	Friendly staff that actually lets you enjoy your meal and the company you're with.
1873	PAS	Although be warned their dinner menu to sit and take out prices are different.
1874	FOOD	Le Pere Pinard has a $15 pre-theater menu that is outstanding.
1875	PAS	Most of the servers are very attentive, friendly and quite attractive.
1876	FOOD	We saw them heating up at least one frozen item though I'm not sure which dim sum dish it was.
1877	MISC	Another welcome addition to the neighborhood.
1878	MISC	Sapphire is the only Indian restaurant I go to when I'm in NYC.
1879	PAS	Definitely not worth the price!
1880	FOOD	The menu may be small, but everything on it is delicious.
1881	PAS	Only drawback - they won't toast your bagel, and they don't make eggs for the bagel.
1882	PAS	Probably much busier for lunch, it's seldom crowded for dinner (too close to downtown).
1883	MISC	Tell them Herky sent you and get a free confused look from the waiter.
1884	PAS	Where Gabriela personaly greets you and recommends you what to eat.
1885	PAS	Also, the place is popular with families, so if you're bothered by children running loose like wild animals, come later at night to avoid them.
1886	FOOD	We usually just get some of the dinner specials and they are very reasonably priced and very tasty.
1887	FOOD	The anti-pasta was excellent, especially the calamari, as were the filling pasta mains.
1888	MISC	I stumbled upon this second floor walk-up two Fridays ago when I was with two friends in town from L.A. Being serious sushi lovers, we sat at the sushi bar to be closer to the action.
1889	PAS	(and I have eaten my share) Which impresses me for having such a large amount of people to serve.
1890	FOOD	The soup is pretty good too.
1891	MISC	This quiet dark asian bistro is well worth the trip.
1892	FOOD	Although, one night we went it was super cheesy, and another night it was less cheesy.
1893	FOOD	They should have called it mascarpone with chocolate chips-good but a far cry from what the name implies.
1894	MISC	There's something smooth about sipping sake upper east side style.
1895	FOOD	Stay away from the latter since you won't go for seconds (hint hint).
