id	category	descript
0	MISC	I've been there three times and have always had wonderful experiences.
1	FOOD	Stay away from the two specialty rolls on the menu, though- too much avocado and rice will fill you up right quick.
2	FOOD	Wow over 100 beers to choose from.
3	MISC	Having been a long time Ess-a-Bagel fan, I was surpised to find myself return time and time again to Murray's.
4	MISC	This is a consistently great place to dine for lunch or dinner.
5	FOOD	I ate here a week ago and found most dishes average at best and too expensive.
6	MISC	First of all Dal Bukhara Rocks.
7	FOOD	Great food at REASONABLE prices, makes for an evening that can't be beat!
8	FOOD	While there are plenty of places to go for a good corned beef sandwich, Katz's has a charm about it.
9	MISC	My first encounter happened one friday evening with a friend.
10	FOOD	one of the best Chicken Tikka Masala.
11	PAS	But the pizza is way to expensive.
12	MISC	Turned out there was full service upstairs and sat down.
13	FOOD	My entree of hot pot with seafood was full of imitation crabmeat with a couple pieces of shrimp and squid, and was unnecessarily heated with a burner.
14	MISC	I will have to say, this Bengali Fast Food joint is clearly my favorite.
15	PAS	The seats are uncomfortable if you are sitting against the wall on wooden benches.
16	MISC	Please save yourself the frustration.
17	FOOD	The food is consistently wonderful - I've been coming here for years, and the owner has always been accomodating and friendly.
18	MISC	--Eat Club is a roving group of NYC gluttons
19	PAS	Good atmosphere, combination of all the hottest music dress code is relatively strict except on Fridays.
20	MISC	So, again, give it a try.
21	MISC	THe perfect spot.
22	MISC	I was pleasantly surprised to find this gem in Hoboken.
23	FOOD	big and soft as well as good lunch food.
24	MISC	If we were to move from the upper east side, we would genuinely miss this restaurant.
25	MISC	In such a crappy part of town to find a good value for lunch, this place is great.
26	FOOD	The food is expensive, but worth every bite.
27	PAS	Priced at upper intermediate range.
28	FOOD	When I lived upstate for a while I would buy freeze the bagels and they would still be better than any else.
29	MISC	We have lived in Chelsea for two years and have never noticed this restaurant.
30	PAS	Zero ambiance to boot.
31	FOOD	The food was mediocre at best but it was the horrible service that made me vow never to go back.
32	FOOD	The food was delicious (I had a halibut special, my husband had steak), and the service was top-notch.
33	FOOD	The bagel was huge.
34	MISC	I would defiantly come back here again as one of my top choices.
35	FOOD	Have the iced tea.
36	MISC	I usually go there later at night when I get off work so I don't have to deal with crowds or lines.
37	MISC	they did give a 15% discount at the end, wasn't enough, as they knew the service was horrible.
38	FOOD	I ordered the smoked salmon and roe appetizer and it was off flavor.
39	PAS	And the staff is also young, energeic and hot!!!!
40	PAS	I love the atmorphere @ peep!
41	PAS	This little place definitely exceeded my expectations and you sure get a lot of food for your money.
42	PAS	It was rather pathetic that it took them over an hour to seat us.
43	PAS	There's nice and quiet, small but enough for 6 (or more).
44	MISC	i went to utsav about a yr ago with my family.
45	FOOD	THE FOOD PORTIONS ARE REALLY LARGE.
46	FOOD	The vibe is very relaxed and cozy, service was great and the food was excellent!
47	FOOD	Personal pans are the perfect size for those hungry nights.
48	FOOD	Their exotic salad is basic ly a delcious little green salad with a peanut sauce that is perfect before their sweet basil fried tofu.
49	PAS	Metrazur has a beautiful spot overlooking the main terminal.
50	FOOD	at taj, vegetarians can rejoice-all the dishes are manna from heaven.
51	PAS	And cheap!
52	FOOD	Food was good and the view of the new york city skiline was terrific even on a foggy rainy day like that of when I went.
53	MISC	This restaurant is such a great place.
54	FOOD	If you like spicy food get the chicken vindaloo.
55	FOOD	This food is asian-air fusion.
56	FOOD	The food was average or above including some surprising tasty dishes.
57	MISC	I recommend to anyone who wants to dress up and impress the lady.
58	PAS	Great roofdeck, nice group of 30 somethings, but no music, kind of quiet.
59	FOOD	Their calzones are horrific, bad, vomit-inducing, YUCK.
60	PAS	It's a nice place to relax and have conversation.
61	MISC	Finally!
62	FOOD	The food is a diamond in rough -- the food is delicious and homemade with the perfect balance of herbs and tomatoes.
63	MISC	Just an odd group.
64	PAS	We live in New Jersey and whenever we go into New York City we buy bagels to eat hot and then to freeze (they told me that if I call in the order, they'd bring it out to the car so I wouldn't have to look for parking).
65	FOOD	Sauce was watery and the food didn't have much flavor.
66	FOOD	The food is usually good but it certainly isn't a relaxing place to go.
67	PAS	First went here to enjoy their garden terrace.
68	FOOD	We had the lobster sandwich and it was FANTASTIC.
69	FOOD	I haven't eat a lamb chop as delicious as that,the salads are really nice dressed with lemon and extra virgnin olive oil.
70	MISC	I loving bringing friends here - and I do so every chance I get.
71	FOOD	The only thing more wonderful than the food (which is exceptional) is the service.
72	FOOD	We visited Bread Bar during January restaurant week and were so pleased with the menu selections and service.
73	PAS	Ambiance and music funky, which I enjoy.
74	FOOD	The service was fast and friendly and the food was very tasty and they had the best hot sauce to add to your meals.
75	PAS	I need at least three rolls to be full, and that's at least $14.00!
76	FOOD	My husband said the portions were very small, but if my main course was good to eat the portion would've been fine for me.
77	MISC	and we were thouroughly disapointed.
78	FOOD	My turkey burger was not cooked at all, my friends salmon was completely raw.
79	MISC	Deff recimmend Bukhara they also have opened two new locations guess ill try them out.
80	FOOD	Tasty but expensive.
81	MISC	Good for casual dinner with jeans and sneakers.
82	MISC	After the review I treked into Brooklyn.
83	PAS	Great atmoshere and worth every bit.
84	FOOD	Ummm...the beer was cold.
85	FOOD	So, for good food i'd recommend it, but not for a fun night out.
86	MISC	We were not disappointed.
87	PAS	The ambience is pretty and nice for conversation, so a casual lunch here would probably be best.
88	FOOD	The garlic mashed potatoes are hands down the best in the city!
89	MISC	As a fan of Thai, I have tried quite a few different restaurants in NYC and this one was definitely the worst.
90	PAS	The ambience is very romantic and definitely a good place to bring a date.
91	FOOD	The white bean brushetta to start was incredible and the pasta was phenomenal.
92	MISC	Good to find a restaurant where the owners have some imagination and they have actually pulled it off, like in this case.
93	MISC	I have been coming to this neighborhood spot for years.
94	MISC	I know because I live nearby.
95	PAS	They charge different prices all the time.
96	PAS	The staff has always been attentive and kind, and I've always been amazed at how they've handled all the various different group sizes that come in.
97	FOOD	Sake collection was excellent (Try Nanbu Bijin), but pricy.
98	FOOD	I am a 100 lb girl, had a glass of wine and a glass of beer prior to the dinner, and I was still HUNGRY after my visit to this place!
99	FOOD	The food is terrible and overall, I would have to say avoid at all costs.
100	FOOD	The pizza is delicious - they use fresh mozzarella instead of the cheap, frozen, shredded cheese common to most pizzaria's.
101	PAS	The music does get a little loud at times, but it just made me want to lean closer to my beautiful wife, and as I did, I got a whiff of corriander.
102	PAS	And, atlhough tables opened up next to us and we ASKED for a slightly larger space, they left us awkardly seated.
103	MISC	What a great place!
104	FOOD	If anyones has doubt of not knowing enough about wines,please check their wine list.
105	MISC	My wife and I went to Orsay for Valentine's dinner.
106	FOOD	They do cater to American palates, but if you like it hot let them know and they are more than willing to oblige!
107	MISC	This is a nice restaurant if you are looking for a good place to host an intimate dinner meeting with business associates.
108	PAS	Diner food at bistro prices is a bummer....
109	FOOD	Edible but really a ripoff at those prices given whats in the area.
110	FOOD	He takes real pride in his food and his business.
111	FOOD	Dahkin also offers prix fixe lunch and buffet.
112	FOOD	The menu looked good, except for offering the Chilean Sea Bass, but the server does not offer up the specials that were written on the board outside.
113	FOOD	I liked the food at this quasi-thai restaurant.
114	MISC	I have been to Casimir over 5 times and I have always had a great time there.
115	MISC	I would definitely recommend Mary's and am making it one of my regular neighborhood haunts.
116	MISC	I recommend ordering in on a weeknight.
117	FOOD	Their bagels are fine, but they are a little overcooked, and not really a 'special' bagel experience.
118	MISC	I've eaten at Pizza Gruppo a few times, but more often I order delivery.
119	FOOD	Delicious food at a great price but do not go here on a cold day and sit by the front door.
120	PAS	Kind, attentive wait staff.
121	FOOD	I also recommend the rice dishes or the different varieties of congee (rice porridge).
122	MISC	I've never felt more unwelcome than last month at Jimmy's Bronx Cafe.
123	MISC	They're terrific!!
124	FOOD	It is about FOOD and Ambiance, and imagine how dreadful it will be it we only had to listen to an idle engine.
125	MISC	My boyfriend and I recently had an early dinner at Artisanal and was satisfied with our experience.
126	MISC	Read all the other review, they'll confirm it.
127	FOOD	I've been to several places for Dim Sum and this has got to be the WORST.
128	FOOD	always fresh and delicious.
129	MISC	we spent 50 $$ definetly will come back with my friends!!!
130	MISC	After dealing with subpar pizza all over the Kensington neighborhood - I've found little toninos.
131	FOOD	The rice was poor quality and was cooked so badly it was hard.
132	MISC	This lovely French-Asian fusion restaurant stands out amongst other great restaurants on Smith Street.
133	PAS	While I'm not sure that this happens all the time-this is the kind of treatment that buys repeat business!
134	MISC	In any event, this is a place I'll be sure to stop by again when I'm in this part of town.
135	FOOD	Great Indian food and the service is incredible.
136	FOOD	It's all about the food !!
137	MISC	...and that's saying a lot.
138	MISC	We got a little tipsy from the sake but isn't that what Saturday nights with the girlfriends are all about?
139	MISC	I would not recommend this place to anyone.
140	PAS	Also, the hostess called me today to thank us for coming and mentioned how she hoped that my girlfriend enjoyed her birthday - unexpected, but a truly above and beyond thing to do...
141	MISC	The entire dining experience was wonderful!
142	FOOD	As much as I like the food there, I can't bring myself to go back.
143	PAS	We had a 3 hour brunch- they definitely do not rush you- and they kept the unlimited mimosas flowing the whole time.
144	FOOD	It's not mind-blowing, but to me, thai food never is and never will be.
145	FOOD	The rest of the dim sum, though pricey by Chinatown standards, is worth it.
146	FOOD	So all I'm trying to say is this restaurant is by far the best thai food restaurant I've ever been to.
147	FOOD	good selection of wines ranging from affordable to high end.
148	MISC	My friends spoke so much about it for months, I finally made the time to come down ear and dine in.
149	PAS	THR AT MOSHPHERE IS COMPACT, MODERN, YET COZY.
150	MISC	I have been going there since it opened and I can't get enough.
151	MISC	It's usually packed for good reason, esp.
152	PAS	The second you walk through the heavy vault like door, with people anticipating your arrival you get the sense that you are going to have the dining ride of a lifetime.
153	PAS	Service was very good and warm.
154	PAS	The people in the restaurant were pretty obnoxious and loud.
155	PAS	Anyhow, we were able to sit as long as we wanted and chat, which was nice.
156	FOOD	The plain slice is great and if you get toppings, the whole slice is topped with them, not sparsely sprinkled on like some places.
157	FOOD	Pick a bagel has the best bagels in the city.
158	MISC	Avoid this place!
159	FOOD	I've been to this restaurant more than a dozen times and when I'm craving for Pho, Lemon grass chicken or Beef Cube on rice, this is the place to go.
160	MISC	I've been living in the Columbia University area for about 10 years with 3 kids - now in their teens.
161	FOOD	The flavors robust and subtle.
162	FOOD	I think I've had some the best meals of my life at minnow.
163	MISC	I took my girlfriend there for her birthday last night and we had a relaxing, really good meal.
164	MISC	When we stumbled on Leon, we thought that we had found quite the gem BUT, we were certainly wrong.
165	FOOD	I really liked the noodle dishes at Rice Avenue compared to their Green Curry dish.
166	PAS	I've always been seated propmtly.
167	MISC	Get your food to go, find a bench, and kick back with a plate of dumplings.
168	FOOD	Then, get ripped on free box wine.
169	MISC	I was pleasantly suprised.
170	MISC	There was a small group of us looking somewhere to eat kinda late on a weeknight and we ended up at Pastis.
171	PAS	Fast service.
172	FOOD	As always we had a great glass of wine while we waited.
173	FOOD	If you are looking for a good quality, cheap eats - this is the place.
174	MISC	moral stay away.
175	MISC	Try it side by side and there's no comparison.
176	MISC	If you can handle that, it's a great place for a business dinner, fun with friends or simply a table for 2.
177	PAS	Drinks way over priced.
178	PAS	The waiter was attentive.
179	MISC	Very different than regular dimsum places.
180	PAS	LOVE the atmosphere - felt like I was in Paris.
181	MISC	SO SO SO SO SO good!
182	PAS	less wait time for me!
183	PAS	The location is perfect.
184	MISC	Good for dates or with friends.
185	PAS	Just bring someone who speaks Cantonese because waiter may not understand you.
186	FOOD	The corned beef and pastrami are excellent, much less fatty than those big tourist places around Times Square.
187	FOOD	Excellent lunch buffet for only $6.95.
188	FOOD	This is the pinnacle of Indian Fast Food (all fast foods in my opinion).
189	FOOD	Quality ingredients preparation all around, and a very fair price for NYC.
190	PAS	Raga's is a romantic, cozy restaurant.
191	FOOD	Their sushi, Kamikaze and other Rolls are fresh and well presented.
192	FOOD	From the spectacular caviar to the hospitable waitstaff, I felt like royalty and enjoyed every second of it.
193	PAS	They showed up 15 minutes after the tuna melt.
194	FOOD	While certain staples are excellent (the burger, some of the pastas), the food is not really the point.
195	PAS	However, I think this place is a good hang out spot.
196	MISC	I just don't understand all the hype...
197	PAS	The waiters and owners were nonchalant about this and promised to call the exterminator but weren't as dismayed or apologetic as I would have expected.
198	PAS	After all that, they complained to me about the small tip.
199	FOOD	No food snobs allowed, this place is for people who appreciate good food.
200	PAS	First off, the waitress was completely unattentive the 2 times we saw her(odd in a restaurant with 6 tables) and got our order wrong.
201	FOOD	The bar has various selections and the mixed drink special is a catcher! 2 for 1's.
202	FOOD	It was nice and fresh, but I can't give it high scores on being authentic thai.
203	MISC	I went there with my friend last saturday.
204	MISC	After reading the posts, I was always skeptical to go to The Minnow, despite living in Park Slope.
205	PAS	If you are in a big group, this place is perfect because it recomends sharing - they have lazy susans on most tables - even families can feel comfortable here.
206	PAS	It's a steal!
207	MISC	Still, try it once, since if you end up loving the food, it could be one of your best dining experiences.
208	FOOD	Delicate spices, onions, eggs and a kick-ass roti.
209	MISC	We had reservations at 9pm, but was not seated until 10:15pm.
210	MISC	Went on a double date with friend and his girlfriend for a few drinks and appetizers.
211	MISC	I highly recommend the Sophia pizza.
212	MISC	Every waitress and customer who passed by me bumped into my chair.
213	MISC	If celebrities make you sweat, then your in for a ride, but if your like most around these parts then you'll just yawn and wonder whats with all the hype.
214	MISC	For being number 1, this place has alot of work to do in order to truly earn its so called reputation.
215	PAS	IT is the best deal in town for a Monday night dinner at a fine restaurant.
216	PAS	Somewhat pricey but what the heck.
217	PAS	His wife Tanya, the hostess, completes the comforting atmosphere by being delightfully warm and gracious.
218	FOOD	Decor is nice and minimalist, food simple yet very well presented and cooked, and the wine list matches the food very well.
219	MISC	This is my favorite Italian restaurant in all of New York City.
220	FOOD	This was the perfect quiet, relaxing, and delicious accompaniment to our afternoon of theater.
221	MISC	This place has got to be the best japanese restaurant in the new york area.
222	FOOD	You must have the crabmeat lasagna which is out of this world and the chocolate bread pudding for dessert.
223	FOOD	In addition, the food is very good and the prices are reasonable.
224	FOOD	Try the lasagnette appetizer.
225	PAS	We had a party in their private room and they made it truly memorable and were very helpful in the planning.
226	FOOD	The staff was very attentive, the ambience lovely, and the food superb.
227	MISC	I went to Del Frisco's Friday night with my boyfriend for an 8:00 reservation.
228	MISC	first it took us a long time to find the place.
229	MISC	This place is so much fun.
230	PAS	I have tried to make reservations, but both times, the hostess didn't have my name.
231	PAS	The design and atmosphere is just as good.
232	MISC	I've eaten thai many times, and am very familiar with the cuisine.
233	FOOD	Best Pastrami I ever had and great portion without being ridiculous.
234	PAS	A gentleman, maybe the manager, came to our table, and without so much as a smile or greeting asked for our order.
235	PAS	When you're sitting in their main dining room (which has a spectacular, hand-painted high ceiling) you'd never know there was a world outside.
236	PAS	Got a little loud after 8pm when the joint got full.
237	FOOD	Not a typical pizza joint, but good for a low key and fairly cheap nice sit down dinner.
238	MISC	I've been to this monster sushi twice, the 46th st once, the 23rd st one a number of times.
239	FOOD	But they've done a really nice job of offering all the typical pizzeria faves plus some terrific specials like the Godmother pizza (a sort of traditional flat pizza with an olive oil-brushed crust and less tomato sauce than usual).
240	MISC	I was in love with Pongsri on 48th, but compared to Suan it is slow in service and overpriced.
241	MISC	I don't live in NY but my best friend does.
242	PAS	The place's decor and hidden bathrooms made for a good laugh.
243	FOOD	They couldn't even make a salad that was appealing.
244	FOOD	Whether it's the parmesean porcini souffle or the lamb glazed with balsamic vinegar, you will surely be transported to Northern Italy with one bite.
245	FOOD	Decent wine at reasonable prices.
246	FOOD	Try their plain pizza with fresh garlic or eggplant.
247	FOOD	Dakshin is one of the few affordable and tasty Indian restaurant in the upper east side.
248	MISC	Visited there while on vacation and reading the reviews.
249	FOOD	Get the tuna of gari.
250	MISC	Don't eat here unless you're starving for thai food and you work next door.
251	FOOD	And its absolutely DELICIOUS.
252	PAS	I cannot imagine a friendlier staff working in a restaurant.
253	FOOD	I'm not picky - but it was actually gross.
254	FOOD	Guacamole+shrimp appetizer was really great, we both had the filet, very good, didn't much like the frites that came with, but the filet was so good, neither of us cared.
255	PAS	I was with a party of 7 (close but not next the the front doors) and we were eating with our coats on.
256	FOOD	They are tasty, but I suggest only eating one with meat because they tend not to mesh that well with the average American digestive system.
257	MISC	We were told that the wait was about twenty minutes and there would be no problem for our 8:00 pm curtain call.
258	FOOD	Too bad the food wasn't of the same heritage.
259	MISC	Have been dozens of times and never failed to enjoy the experience.
260	PAS	My co-workers had to wait almost an hour for delivery, only to discover that what they got was not what they ordered.
261	FOOD	Deep Fried Skewers are good and still rare to find in NYC.
262	FOOD	We were very surprised by how good the food was on our first visit here on a Sunday night.
263	FOOD	By far the best salad I have had in a fast food restaurant.
264	FOOD	fine dining restaurant quality.
265	PAS	Overall, worht every penny.
266	FOOD	This place has realy fresh sushi and a nice large menu of Japanese classic cuisine.
267	PAS	In fact, it appears he is going to go postal at any moment.
268	MISC	We thought this a prelude to what the evening will be like.
269	MISC	from an English speaking staff.
270	FOOD	it's a perfect place to have a amanzing indian food.
271	MISC	my first time here was with my gf for our 12 month anniversary.
272	MISC	This was on a Tuesday night.
273	PAS	We went around 9:30 on a Friday and it had died down a bit by then so the service was great!
274	MISC	We were on our way back to NJ, and since I am in NY, we figured why not grab some food?
275	PAS	I had been searching really hard for a restaurant in New York where I could really feel unwanted and ignored and I finally found it!
276	FOOD	Stick to the gulab jamun.
277	MISC	This place started off a little iffy, but is now one of my favorite indian restaurants in NYC (and I'm indian, so I should know).
278	MISC	We will definitely go back.
279	FOOD	It melted in my little mouth and the perfect consistency-not too fishy, creamy, and slightly buttery.
280	MISC	SEA has become so popular that they've let it go to their heads.
281	FOOD	bottles of wine are cheap and good.
282	MISC	I was very disappointed with this restaurant.
283	FOOD	We always have a delicious meal and always leave feeling satisfied.
284	FOOD	The first 2 courses were very good, but the chocolate sampler was too rich for me and the dessert wine far too sweet.
285	PAS	There is not a single place in Chinatown where you have a nice neighborhood feeling like here.
286	PAS	The service was the only thing good about this restaurant.
287	MISC	We ate outside at Haru's Sake bar because Haru's restaurant next door was overflowing.
288	MISC	Once for dinner and once for brunch.
289	PAS	Only complaint would be that at an average cost of $12-$15 per meal, I'd like not to have to worry about finding a seat!
290	PAS	Drawbacks: service is slow and they don't toast!
291	PAS	Ambience is delightful, service impeccable.
292	MISC	I'm just reading some of these reviews and its nonsense that people are reviewing some places because it was too loud.
293	MISC	Not a great place for family or general dining.
294	MISC	i have eaten here a handful of times, for no reason besides sheer convenience.
295	MISC	One of my favorite restaurants in the neighborhood.
296	FOOD	The lava cake dessert was incredible and I recommend it.
297	MISC	I've been eating at Taj Mahal for over twenty years and have found them to be the most excellent of the Indian eateries on this block of Indian restaurants.
298	MISC	This isn't your corner Chinese food takeout.
299	FOOD	All the appetizers and salads were fabulous, the steak was mouth watering and the pasta was delicious!!!
300	FOOD	The ambience was so fun, and the prices were great, on top of the fact that the food was really tasty.
301	MISC	Katz's deli is a great NY experience.
302	MISC	When I called this morning, I didn't think I would be able to get in at 12, but I was able to get in, along with four other guests.
303	MISC	This is the Cheers of New York, whether you've ever been there or not.
304	MISC	I can't believe people complain about no cheese sticks?
305	MISC	A little pricey but it really hits the spot on a Sunday morning!
306	MISC	What a great place.
307	FOOD	With the great variety on the menu , I eat here often and never get bored .
308	PAS	Service is extraordinary, yet not overbearing, and the decor brings a taste of trendy SoHo into Queens.
309	FOOD	With so many good restaurants on the UWS, I don't need overpriced food, absurdly arrogant wait-staff who don't recognize they work at a glorified diner, clumsy service, and management that doesn't care.
310	MISC	I have been to Mary's many times and I like it.
311	PAS	If you like your music blasted and the system isnt that great and if you want to pay at least 100 dollar bottle minimun then you'll love it here.
312	FOOD	Terrific menu full of unique rolls and special dishes.
313	FOOD	The bread is the soft paratha bread (unlike the plain bread they use in Calcutta), and the stuffing is tandoori styled and very flavorful.
314	FOOD	just got back from lunch at Tamarind and it was excellent.
315	PAS	But the best part about LS is the late night atmosphere, delightfully free of the BTs.
316	MISC	This is a cute place and could be good but they need to get their act together.
